{
  "metadata": {
    "contract_version": "1.0",
    "engine_version": "1.0",
    "plugin": "google_ads",
    "plugin_version": "1.0",
    "generated_at": "2026-07-17T19:46:25.477Z"
  },
  "triggered_rules": [],
  "passed_rules": [],
  "validation_summary": {
    "total_rules_evaluated": 0,
    "total_triggered": 0,
    "total_passed": 0,
    "errors": []
  }
}